id,profileName,text,date,title,rating,images,helpful,Colour
R2KJHO9FRTDYPY,RITWIJA ENTERPRISES,Damaged product received. It is damaged below near the wheel,Reviewed in India ・・・ｮ・・・ｳ on 31 January 2021,Damaged,3,https://images-na.ssl-images-amazon.com/images/I/81m1bVjOZiL.jpg,0,Grey Dazzle
RYDWKML3NUF4,Anubhav Awasthi,Amazing product at the price. Works absolutely fine and easy to move.,Reviewed in India ・・・ｮ・・・ｳ on 15 July 2021,Amazing product,5,,0,Grey Dazzle
R3CBOG4YL8N3ND,Rima Ghosh Seal,Very good,Reviewed in India ・・・ｮ・・・ｳ on 10 December 2021,Very good,5,,0,Grey Dazzle
R3Q16ZNWJBQXEG,Sai Praveen,Good,Reviewed in India ・・・ｮ・・・ｳ on 31 October 2020,Good,4,,0,Grey Dazzle
R27DVPJFU601MC,Deepak Tiwari,Very good product. Excellent capacity.,Reviewed in India ・・・ｮ・・・ｳ on 30 June 2020,Value for money.,4,,0,Grey Dazzle
RRAXM2ARQ61WY,Jubil,Nice product.,Reviewed in India ・・・ｮ・・・ｳ on 19 September 2020,Very good product. Worth for miney,4,,0,Grey Dazzle
R1JMO4E5EGEHFI,Ram prasad,Not satisfied,Reviewed in India ・・・ｮ・・・ｳ on 21 December 2022,Deal is not good,1,,0,Grey Dazzle
R1HD7UXK1G47PE,guru prakash,"Got defective product, when I call amazon customer care, he say not able to replace after delivery, request you to replace as soon as possible.",Reviewed in India ・・・ｮ・・・ｳ on 9 December 2021,Defective product,2,"https://m.media-amazon.com/images/I/61We2ZffpiL.jpg
https://m.media-amazon.com/images/I/61mM86sJxlL.jpg",0,Grey Dazzle
RZ4X3VW3A4QGB,Gladwin Jose B,Amazing Product,Reviewed in India ・・・ｮ・・・ｳ on 7 December 2021,Simply Superb,5,,0,Grey Dazzle
R3EUDBKL3CJT08,Niraj K.,unable to start after use of 1hr.,Reviewed in India ・・・ｮ・・・ｳ on 13 March 2021,Must read berofe buy,3,,0,Grey Dazzle
R1YC5ME026IYS8,Bharat B.,GOOD ENOUGH.,Reviewed in India ・・・ｮ・・・ｳ on 19 September 2020,NICE,4,,0,Grey Dazzle
RXCSO5NELKLLL,ajay kumar,Good one,Reviewed in India ・・・ｮ・・・ｳ on 15 September 2020,Good one,4,,0,Grey Dazzle
RM7K941Q9HW0C,Ramshi,Helpful,Reviewed in India ・・・ｮ・・・ｳ on 21 October 2020,Good,4,,0,Grey Dazzle
R1QLK1VRQ76WQ1,Nisha Yadav,Very nice,Reviewed in India ・・・ｮ・・・ｳ on 24 September 2020,Helpful,4,,0,Grey Dazzle
RV948D38WIP0B,Amazon Customer,Whirlpool washing machine always great ・・・・,Reviewed in India ・・・ｮ・・・ｳ on 18 September 2021,Value for money,5,,0,Grey Dazzle
R2ZWKBXHJTU01W,Devesh Ranjit,"Whirlpool is a big and renowned name.7kg is good for small family.Easy to use. Great color option, won't get dirty easily.Thank u Amazon.",Reviewed in India ・・・ｮ・・・ｳ on 1 November 2020,Whirlpool...worth buying it.,5,"https://images-na.ssl-images-amazon.com/images/I/613K67bDamL.jpg
https://images-na.ssl-images-amazon.com/images/I/61DNm-VDHBL.jpg",0,Grey Dazzle
ROG9FTEDYFRX8,Arshi Bano,Price are reasonable and less than other shopping apps.and Amazon also gives me No cost EMI Option for buying this machine..it really helpfull for men so happy . worth product and Must buy . Amazing shopping experience with Amazon.thanks,Reviewed in India ・・・ｮ・・・ｳ on 21 January 2020,Happy customer..Amazon rocks..,5,"https://images-na.ssl-images-amazon.com/images/I/71Gf5mfiSmL.jpg
https://images-na.ssl-images-amazon.com/images/I/71GkNLdKeIL.jpg
https://images-na.ssl-images-amazon.com/images/I/71eA3ncfUTL.jpg
https://images-na.ssl-images-amazon.com/images/I/71p0nfx5ziL.jpg",0,Grey Dazzle
R30A49C9R8TF8H,M Suresh Babu,"Very much disappointed with the option Whirlpool has given for Water input slelction; earlier models has a Knob where we can move Left & Right for water input selection for Wash & Spin respectively. But this model has really diappointed me with selection of water input between two holes. THIS IS REALLY BAD option. THIS OPTION ALONE OF SELECTING WATER INTO HOLES, ONE FOR WASH AND OTHER FOR SPIN IS REALLY A WORST DESIGN I HAVE EVER SEEN. Apart from that machine is good.",Reviewed in India ・・・ｮ・・・ｳ on 19 October 2021,Worst option of water input selection,1,https://m.media-amazon.com/images/I/51qg79MsEjL.jpg,0,Grey Dazzle
R2KZ7J93MDXR66,Deepen shet,Great product working fine. Little noicey but ecpected for this price point.,Reviewed in India ・・・ｮ・・・ｳ on 26 June 2021,Go for it,5,https://images-na.ssl-images-amazon.com/images/I/A1HWhXHXcvL.jpg,0,Grey Dazzle
REV6855CX55Z2,K SELVARAJ,Very good Product my mom full Happy for this tq Amazon,Reviewed in India ・・・ｮ・・・ｳ on 19 June 2021,All features good,5,"https://images-na.ssl-images-amazon.com/images/I/B1WJp-dCusS.jpg
https://images-na.ssl-images-amazon.com/images/I/B1fv3rJ8GJS.jpg",0,Grey Dazzle
RB28ZCYZSOQYM,Kanak,Fabulous working and also look,Reviewed in India ・・・ｮ・・・ｳ on 25 September 2021,Good,5,,0,Grey Dazzle
R32X3WUAHN6GT,K Dhanasekar,Amazing product. Easy to use very effecient wash. Driyer works really good. I purchased this product with a good deal as well. Thank you Amazon for quick delivery.,Reviewed in India ・・・ｮ・・・ｳ on 25 September 2020,Happy Customer・・・・,5,"https://images-na.ssl-images-amazon.com/images/I/615WgehXWiL.jpg
https://images-na.ssl-images-amazon.com/images/I/61tsJicNzUL.jpg
https://images-na.ssl-images-amazon.com/images/I/715ArmsrjPL.jpg",0,Grey Dazzle
R1KIW3JL46DTET,muralidharrao mopidevi,Wash and spin single pipe has to be changed manually every time in stead of switch boring,Reviewed in India ・・・ｮ・・・ｳ on 21 August 2020,Wash and spin switch not provided,3,,0,Grey Dazzle
R2QIP19GQVW31V,Rais khan,Value for money,Reviewed in India ・・・ｮ・・・ｳ on 9 November 2021,Total worthy  product,5,,0,Grey Dazzle
R3OUKVB3EBGS3P,sharad,I have received this washing machine with manufacturing fault as it's dryer was not working. Then I asked for replacement and received replacement within 2 days. Same fault again occured as it's dryer was again not working along with dryer switch as well as it's drainage system also not working this time. I just wasted my money. Now Amazon's is not answering me except service person... It's total loss of your hard earning money...pl keep away yourself to buy big appliances from AMAZON..now they have keep their hand up saying it's not their responsibility...Pl buy big appliances from your local shops only and not from online....i feel cheated very badly...Even though they have not send anybody for installation saying that it's not required....vey helpless situation I am feeling now....,Reviewed in India ・・・ｮ・・・ｳ on 16 October 2020,DO NOT BUY THIS WASHING MACHINE..PL,1,,9,Grey Dazzle
R2I07N6YCZW5GE,Iswarya,It's nice,Reviewed in India ・・・ｮ・・・ｳ on 24 August 2020,Good product.,4,,0,Grey Dazzle
R17EGAYNJS4RE1,kala,ALL SAID IT AND I ENDORSE AFTER USING FOR 4 MONTHS,Reviewed in India ・・・ｮ・・・ｳ on 22 June 2021,GOOD GOOD AND GOOD,5,,0,Grey Dazzle
R3BCYAWIAA4PJH,satya,Good,Reviewed in India ・・・ｮ・・・ｳ on 29 November 2021,Good,5,,0,Grey Dazzle
R1R70OTI83TJRB,Aakash Sharma,"According to price, carry, and moving is very well.",Reviewed in India ・・・ｮ・・・ｳ on 5 July 2021,product,5,,0,Grey Dazzle
R5D6ZRGDN84VY,sreelatha,We want technician to show  how to use,Reviewed in India ・・・ｮ・・・ｳ on 30 December 2020,Technician  didn't  come,3,,0,Grey Dazzle
R39IQE7MVGWGNV,Kalyan vardhan,Worth for money untill now no issues we bought six to eight months back,Reviewed in India ・・・ｮ・・・ｳ on 9 May 2021,Good product,5,,0,Grey Dazzle
R1T6G8FZY9WR8M,Mohammed,Happy,Reviewed in India ・・・ｮ・・・ｳ on 27 November 2021,Thanks,5,,0,Grey Dazzle
R2CQN8U4YVLTHP,Vikas Kumar,"Good product, same as shown. Delivery is very fast and in time . Can be ordered and enjoy the product",Reviewed in India ・・・ｮ・・・ｳ on 21 January 2023,Nice,4,,0,Grey Dazzle
R1P51GHUCW66KU,Rathod Ramesh,Easy to use and easy to handle bcoz it's light weight,Reviewed in India ・・・ｮ・・・ｳ on 25 June 2021,Happy with this..,5,,0,Grey Dazzle
R3ONJRK80V1VH9,Tarun Bhushan,Nice product. Noise level is low and look is decent as well.,Reviewed in India ・・・ｮ・・・ｳ on 28 May 2021,Nice,5,,0,Grey Dazzle
R2ICGBDXCKXTMV,Ashutosh Bajrangi,Looks soft but is really a good machine,Reviewed in India ・・・ｮ・・・ｳ on 2 January 2021,Zehar h bhai,3,,0,Grey Dazzle
R185E2WUWHV0BW,Hradesh Singh Payak,Very good,Reviewed in India ・・・ｮ・・・ｳ on 14 November 2021,Very food,5,,0,Grey Dazzle
RDILGN0HTRH5E,SUBHAS GANGULY,there is  no  mechnism to switch  water inflow  from  wash tub to spin tub,Reviewed in India ・・・ｮ・・・ｳ on 13 July 2020,deficiency in the model,3,,0,Grey Dazzle
R2UJJEUW2C0WWJ,Nandlal Yadav,V.GOOD,Reviewed in India ・・・ｮ・・・ｳ on 5 December 2021,GOOD,5,,0,Grey Dazzle
R1FUC809O2APCZ,prashant saxena,It's dryer not working,Reviewed in India ・・・ｮ・・・ｳ on 14 March 2021,Dryer not working,3,,0,Grey Dazzle
R3MY6TQ3E46NNA,SHIVAM SHARMA,"Easy to Use and Light Weight, Comfortable in use.",Reviewed in India ・・・ｮ・・・ｳ on 13 July 2021,Valuable Item in this Range.,5,,0,Grey Dazzle
RKQN5O8Z4EK0Z,jaspreet singh,"Too much light, feel like a toyBut good in this price",Reviewed in India ・・・ｮ・・・ｳ on 3 October 2019,Washing machine,4,,0,Grey Dazzle
R329DWXA70IIX,Himanshu,Easy to use,Reviewed in India ・・・ｮ・・・ｳ on 27 July 2020,Nice product,4,,0,Grey Dazzle
R1EYPGZMNKDQ0P,Vikas Ayinampudi,Good,Reviewed in India ・・・ｮ・・・ｳ on 17 September 2020,Good but costly of price for a semi automatic,4,,0,Grey Dazzle
R17C89J6TFL6F9,Saurabh,Awesome,Reviewed in India ・・・ｮ・・・ｳ on 4 December 2021,Nice product,5,,0,Grey Dazzle
R3CLTPAVV7OOX6,Hemanth,"Good for large family(6). Best in class whirlpool, very easy to use, colour is nice which hides stains & dust. Less noise & vibration compared to other machines. can blindly go for it.",Reviewed in India ・・・ｮ・・・ｳ on 12 June 2020,Perfect for Large Family,5,,0,Grey Dazzle
R9C4ZX5KDS0A0,naveen jain,Recently I bought this 7kg Whirlpool washing machine. It was so amazing so smooth machine no noise. So much nice machine with 8090/- rs I Paid. Thank you whirlpool and Amazon.https://amzn.to/30yJE8s,Reviewed in India ・・・ｮ・・・ｳ on 12 June 2020,Value for Money,5,,0,Grey Dazzle
RKCU71Y08NPBB,s.mehboob shaikh,Very good and nice looking washing machine no noise,Reviewed in India ・・・ｮ・・・ｳ on 11 July 2021,Very good washing machine,5,,0,Grey Dazzle
RV9ARJHH94FEV,Kunal Gaur,Light weight and easy to use... But I have got a used and a defective one...,Reviewed in India ・・・ｮ・・・ｳ on 13 August 2020,Affordable price,3,,1,Grey Dazzle
R1ZT019JCS8SBQ,satish  shelar,There is not warranty card in package box.when will i get warranty cardnoboddy is come for installation.,Reviewed in India ・・・ｮ・・・ｳ on 10 July 2020,warranty card,3,,0,Grey Dazzle
R2O9VSCN4FMNZ0,Amazon Customer,Ok,Reviewed in India ・・・ｮ・・・ｳ on 2 December 2021,Good one,5,,0,Grey Dazzle
RONP7X4G74XX2,Rajeshwari C.,The product is okay but the price can be little less,Reviewed in India ・・・ｮ・・・ｳ on 8 November 2019,DECREASE PRICE,4,,0,Grey Dazzle
R1D4NZ11N42I9G,sakthivel,"Please check all the wheels and plastic body, when the purchase it's just stick after 4 months usage it's going inside. So if your are buying please test all the things with hard touch. Customer support telling this plastic not covered in warranty. Very disappointed. My trust on Whirlpool is gone.",Reviewed in India ・・・ｮ・・・ｳ on 9 June 2022,Warrenty is waste,1,https://m.media-amazon.com/images/I/61YkRJCKhYL.jpg,1,Grey Dazzle
R1E8BTRGAA1JL1,Yashanbrar,Amazing for a family of 2 ・・・・Good price and quality,Reviewed in India ・・・ｮ・・・ｳ on 9 June 2021,Good buy,5,,0,Grey Dazzle
RPQUIHA29C38Q,Khagendra,Good product. We are two member though but usage is high. Would recommend,Reviewed in India ・・・ｮ・・・ｳ on 22 April 2021,Good product,5,,0,Grey Dazzle
R13KLAF35OZY1P,sawhney,"Water inletpipe has to be removed while using washtub and spinner again and again , so it is cumbersome to use and also consumes lot of electricity.",Reviewed in India ・・・ｮ・・・ｳ on 14 September 2021,Consumes lot of electricity,2,,0,Grey Dazzle
R9RF8E7Y855BY,manish pratap singh,Easy to use economical,Reviewed in India ・・・ｮ・・・ｳ on 24 September 2021,Gr8 product,5,,0,Grey Dazzle
R1AYUT75SSBE05,Priyank,After 1 month usage i post review.. Good product wgen you want semi automatically washing machine... No complaints till now.. Working really good.,Reviewed in India ・・・ｮ・・・ｳ on 17 October 2020,Nice and simple to use,5,,0,Grey Dazzle
R25ZCNWIO2XTGI,ismail ali khan,Very nice and  powerful motor and easy to move as it has wheels under it which makes moving very easy.,Reviewed in India ・・・ｮ・・・ｳ on 13 December 2020,Very nice and powerful motor with wheels value for money.,5,,0,Grey Dazzle
R1WPBR6XH133OD,Shaikh zahir,It is lightweight good motor easy to use,Reviewed in India ・・・ｮ・・・ｳ on 11 December 2020,Nice product,3,,0,Grey Dazzle
R2PN9WDUBINZ7L,NDP,Nic machine ・・・・,Reviewed in India ・・・ｮ・・・ｳ on 30 June 2020,Nice product,4,,0,Grey Dazzle
R2OPRJBB5NKXTK,Abhishek,ﾂI brought this washing machine twice. 1st time I was brought for my sister and it's new one. After 6 months I brought 2nd one and god old machine. Machine I got is full of dust and back pannel having issues like bolt missing etc. Macine is eighter refurbished or its used one. Cloud tail sailer is really did rubbish things. Completely disappointed by cloud tail.,Reviewed in India ・・・ｮ・・・ｳ on 22 June 2021,Cloud tail is worst seller. Boodly hell.,1,,29,Grey Dazzle
R1LSUM1XORTLXO,Vivek  Mittal,"Hated the product to its core. They have cut the corner on everything. It looks so big in the Amazon picture portfolio but is so tiny in real. I would have had perfect product, had I bought from offline stores.Anyway, lesson learnt. Only buy Mobiles from Amazon and everything else strictly offline",Reviewed in India ・・・ｮ・・・ｳ on 31 December 2020,"Machine Is actually very small, don't go by the pictures",2,,0,Grey Dazzle
R51FCPH630K4V,Raj Kumar prasad,Product recived damage .Don't take no replacement is done,Reviewed in India ・・・ｮ・・・ｳ on 19 October 2022,Don't take defective piece is given,1,,0,Grey Dazzle
R1M2FTMOFJRA6P,Amazon Customer,Easy to use..nice product design..light weight..durable,Reviewed in India ・・・ｮ・・・ｳ on 1 August 2021,Best product in this price range,5,,0,Grey Dazzle
R3G4Q5OBIRA834,Upmanyu singh,"Very light machine body , machine vibrate very heavily while in use..not recommend this product at all.",Reviewed in India ・・・ｮ・・・ｳ on 16 December 2021,Not Recommend,2,,0,Grey Dazzle
R354MFGWJ3Z88L,Samarth s.,Materials not so good,Reviewed in India ・・・ｮ・・・ｳ on 21 January 2021,Product quality not so good,3,,0,Grey Dazzle
R1ICJ82B9ALVOC,Pulkit kkkkk,Good,Reviewed in India ・・・ｮ・・・ｳ on 12 August 2020,Good,4,,0,Grey Dazzle
R3VIDWI23266NH,kasim,Good experince by your delivery team,Reviewed in India ・・・ｮ・・・ｳ on 22 July 2021,Thank u Amazon,5,,0,Grey Dazzle
R2SL9LZASOIF06,Malobika,Really very good product. I love it,Reviewed in India ・・・ｮ・・・ｳ on 29 June 2021,Superb,5,,0,Grey Dazzle
R3JXRZ711VHM0B,Gobinath Balasubramani,Worth able,Reviewed in India ・・・ｮ・・・ｳ on 5 July 2020,Value for money,4,,0,Grey Dazzle
RXVXQAPPTR2FR,Satyajit Naik,Unusual noise while washing,Reviewed in India ・・・ｮ・・・ｳ on 18 January 2021,Hi fast timely delivery..,3,,0,Grey Dazzle
R22AQ4MX4AGUJM,j anandan,Very easy to use,Reviewed in India ・・・ｮ・・・ｳ on 29 August 2021,Nice products,5,,0,Grey Dazzle
R2DB3J45MDCIUL,Kamlesh Kr Pathak,Water leaking from Ringe / dryer tub....defective machine delivered to me,Reviewed in India ・・・ｮ・・・ｳ on 15 October 2022,I got cheated. I received a defective product through Amazon,1,,1,Grey Dazzle
R2ICQM9THRGLUF,Arti Gupta,Easy to use. Overall good but may be u get little problem with pipe while using.,Reviewed in India ・・・ｮ・・・ｳ on 30 January 2021,Before buy look at the image clearly,5,,0,Grey Dazzle
R2VPVWW9VNBVHW,Arcy Vanchhawng,Very very good...Thank you so much i am so happy,Reviewed in India ・・・ｮ・・・ｳ on 16 April 2021,Good quality,5,,0,Grey Dazzle
R2WKB7A4YFRL8F,Harishbabu,I am used 1 month still  now nice to working.,Reviewed in India ・・・ｮ・・・ｳ on 2 April 2021,Worth product,5,,0,Grey Dazzle
R3FSGIPOOVJCJ4,muthuramalingam,Item is good but delivery too late,Reviewed in India ・・・ｮ・・・ｳ on 25 December 2019,Late delivery,4,,0,Grey Dazzle
R2XQOLXTICJ071,Adwait,Excellent Washing Machine.,Reviewed in India ・・・ｮ・・・ｳ on 29 August 2021,Just go for it !!!,5,,0,Grey Dazzle
R29DMC2ZNTQ61W,Ganesh,Awesome product,Reviewed in India ・・・ｮ・・・ｳ on 22 June 2020,Thank you amazon,4,,0,Grey Dazzle
RNKVSR3BRD0SC,Navneet kaur,"Only thing that diappoints is it water outlet pipe at the back. If it had been at the side, it would have been better.",Reviewed in India ・・・ｮ・・・ｳ on 22 August 2020,Love it...5 stars,5,,0,Grey Dazzle
R24SDCNG89TN3C,Rijwana begam,It's awesome very useful.tks to Amazon . after 3 months using best price and quality,Reviewed in India ・・・ｮ・・・ｳ on 23 January 2021,Awesome,5,,0,Grey Dazzle
RY4BGQ6WD1094,nani,Easy to use...Worth it ・・・・,Reviewed in India ・・・ｮ・・・ｳ on 27 June 2021,Nice,5,,0,Grey Dazzle
R2HGMZQDOUKF3Z,nitish pradhan,Good one at this price,Reviewed in India ・・・ｮ・・・ｳ on 3 March 2020,Rvw,4,,0,Grey Dazzle
R24CSVWIU33HZG,Hussain ali,Exelent,Reviewed in India ・・・ｮ・・・ｳ on 24 June 2020,Good,4,,0,Grey Dazzle
R2RRA852VBDB8J,Amazon Customer,Good product. Saves water and electricity use,Reviewed in India ・・・ｮ・・・ｳ on 1 June 2021,Good product,5,,0,Grey Dazzle
R3TKC6OFAGOV96,Ramaswamy Iyer,"Hats off to Whirlpool, Product was as displayed. Within 2 days technician visited and gave required tips for safe use.",Reviewed in India ・・・ｮ・・・ｳ on 2 November 2020,Good Service,5,,0,Grey Dazzle
R30VYIKVOTC3UD,arun johnson,Go for it,Reviewed in India ・・・ｮ・・・ｳ on 22 August 2021,"Very easy to use, best option available.",5,,0,Grey Dazzle
R2YH6K3GHLQRPN,Manusha Rajulapati,"Amazing product we can use salt water also for washing, easy to operate I made a good buy",Reviewed in India ・・・ｮ・・・ｳ on 10 November 2020,Harsh water  usage,5,"https://images-na.ssl-images-amazon.com/images/I/71+FAjSO++L.jpg
https://images-na.ssl-images-amazon.com/images/I/71hjI6aCmiL.jpg",0,Grey Dazzle
R58NW70RCPA2V,Aashish kamboj,Wheel side broken dameged product,Reviewed in India ・・・ｮ・・・ｳ on 27 January 2022,Damaged product,2,https://m.media-amazon.com/images/I/61fyjaV9VSL.jpg,1,Grey Dazzle
R1G87HHHD13EEH,Amazon Customer,Since i bought this product obviously by mistake I have been facing trouble on daily basis. The heavy noise first from sipnner and now from washing tub...and the support from service centre seriously unbelievable...every time called them just mistake lead and no manner of customer handling..Total waste of money...I want this defective process to be replaced,Reviewed in India ・・・ｮ・・・ｳ on 14 February 2022,Total waste of money,1,,0,Grey Dazzle
R1RHXZNRA06JHT,Harish c.,Good product from Amazon,Reviewed in India ・・・ｮ・・・ｳ on 29 July 2021,Good product from Amazon,5,,0,Grey Dazzle
R17S3CBUT5JXC8,Manjiri,Disliked how it stops working at certain intervals where we have to manually set the timing to another so that it further operates.,Reviewed in India ・・・ｮ・・・ｳ on 17 August 2021,Received one with a defect,2,,0,Grey Dazzle
R2T8KCJX57XP7V,Jaspreet Singh,Great value for money product,Reviewed in India ・・・ｮ・・・ｳ on 4 March 2020,Whirlpool is always best,4,,0,Grey Dazzle
R38XVZSZKZQ8JI,Avishek Mukherje,"It's a perfect choose for small family like 3-4 people, fit within my budget and performing very good as on date",Reviewed in India ・・・ｮ・・・ｳ on 18 September 2020,Perfect choice within budget,5,"https://images-na.ssl-images-amazon.com/images/I/61Nx+rszTcL.jpg
https://images-na.ssl-images-amazon.com/images/I/61OwD7FJSmL.jpg
https://images-na.ssl-images-amazon.com/images/I/61jLZ1Ae0XL.jpg",0,Grey Dazzle
R1KI9NZAOEY32E,Geethika Patnaik,Whirlpool agent didn't came yet to explain us about washing machine,Reviewed in India ・・・ｮ・・・ｳ on 16 August 2020,Problem,3,,0,Grey Dazzle
R11UEOUCOQ8ZQ5,Abid hassan,Good product,Reviewed in India ・・・ｮ・・・ｳ on 1 January 2021,Some parts is updated,3,,0,Grey Dazzle
R2CHYSKC8WFISJ,ashmit,Its good but its little bit,Reviewed in India ・・・ｮ・・・ｳ on 24 January 2020,Good,4,,0,Grey Dazzle
R1JNL5E6JLZ0V2,Amit Jadhav,Easy to use,Reviewed in India ・・・ｮ・・・ｳ on 14 August 2021,Nice product,5,,0,Grey Dazzle
R3M0WNIVTB1KOH,Majazul Haque,Great product,Reviewed in India ・・・ｮ・・・ｳ on 21 May 2020,Great product,4,,0,Grey Dazzle
RO2TMQ1VH2AJ6,TUSHAR BHARDWAJ,Best in class,Reviewed in India ・・・ｮ・・・ｳ on 13 August 2021,Best in class product,5,,0,Grey Dazzle
R2WKMBKELH3KG7,nirmal,Economical and works well .,Reviewed in India ・・・ｮ・・・ｳ on 6 July 2021,Good washing machine ・・・・,5,,0,Grey Dazzle
R2SAW1CT7I5W5F,Satish Patel,When washing is started it moves. Machine works good but wheel design is not good.,Reviewed in India ・・・ｮ・・・ｳ on 6 June 2020,Wheel movement when wash.,3,,0,Grey Dazzle
R1Z5VTM9GJ5E1K,Amazonian,Just Go for it.. Super,Reviewed in India ・・・ｮ・・・ｳ on 3 July 2021,Excellent Product,5,,0,Grey Dazzle
RBZA38FT6N4X3,Prashant dubey,Happy with the item,Reviewed in India ・・・ｮ・・・ｳ on 21 July 2021,Happy,5,,0,Grey Dazzle
R1Z09416LDMPGU,Bali mavi,This product is fantastic....・・・,Reviewed in India ・・・ｮ・・・ｳ on 12 March 2020,Bought washing machines,4,,0,Grey Dazzle
R3JFFJEL740RZX,Kapil parmar,Excellent,Reviewed in India ・・・ｮ・・・ｳ on 20 September 2021,One day prior deliver ..... machine Service very good...,5,,0,Grey Dazzle
RKEXUE7TYTHG1,Manish kumar,"Nice product, easy to use.",Reviewed in India ・・・ｮ・・・ｳ on 28 June 2021,Quality product,5,,0,Grey Dazzle
R1KXTRE6GVBI02,Shefali bansal,Very good product・・・・,Reviewed in India ・・・ｮ・・・ｳ on 3 August 2021,Very good・・・・,5,,0,Grey Dazzle
R2QQ1PXDH0NA8W,madhan,A product came with dryer problem but Finally the problem rectified by whirpool technician.,Reviewed in India ・・・ｮ・・・ｳ on 5 January 2021,Good product,5,,0,Grey Dazzle
R31DN53VG293K0,Marimuthu S,Good,Reviewed in India ・・・ｮ・・・ｳ on 5 June 2020,Good,4,,0,Grey Dazzle
R2N4P8VBD7D0XZ,Panda,ﾂWashing machine function smooth but plastic body brittle and fragile,Reviewed in India ・・・ｮ・・・ｳ on 31 October 2022,Plastic body,1,"https://m.media-amazon.com/images/I/51Moqt7lFIL.jpg
https://m.media-amazon.com/images/I/51gI+c1a1RL.jpg
https://m.media-amazon.com/images/I/51kmuvtJTvL.jpg",0,Grey Dazzle
R17FJEFK66VLN7,niyaz shaikh,Easy to use..good purchase thank you Amazon ・・・・ｸ・・・・・,Reviewed in India ・・・ｮ・・・ｳ on 9 April 2021,Thank you Amazon,5,,0,Grey Dazzle
R3GWSPAOO2SRK5,Realme c11,Easy to use,Reviewed in India ・・・ｮ・・・ｳ on 4 August 2021,Item is very good for the price,5,https://m.media-amazon.com/images/I/A104uq3PbsL.jpg,0,Grey Dazzle
R36NMUX81ZWWF9,Sun,Excellent washing machineTakes less spaceClothes washing quality excellentConsumes less water,Reviewed in India ・・・ｮ・・・ｳ on 27 January 2021,Best product,5,,0,Grey Dazzle
R2KHGU77C1Y5H9,Sonal,Good,Reviewed in India ・・・ｮ・・・ｳ on 12 September 2021,Good,5,,0,Grey Dazzle
R1IGSO25Z7F17W,usmankhan,Full of satisfaction product,Reviewed in India ・・・ｮ・・・ｳ on 10 July 2021,Up to the mark product,5,,0,Grey Dazzle
RZWOKWSO6DM4I,Yogesh Karne,Best product in this value range.,Reviewed in India ・・・ｮ・・・ｳ on 22 December 2019,Best product in this value range.,4,"https://images-na.ssl-images-amazon.com/images/I/61CJrV6WSkL.jpg
https://images-na.ssl-images-amazon.com/images/I/61gWYWBtcDL.jpg
https://images-na.ssl-images-amazon.com/images/I/71FLnkZEAeL.jpg
https://images-na.ssl-images-amazon.com/images/I/71MRTrIrSeL.jpg",0,Grey Dazzle
R390H84YV1KELH,Naveen,Used and damaged product received,Reviewed in India ・・・ｮ・・・ｳ on 20 January 2022,Used product received,2,,0,Grey Dazzle
R19RNP81TJBF05,Placeholder,Good product for this price.. Eady for operate.. ・・・・ Nice appear,Reviewed in India ・・・ｮ・・・ｳ on 23 February 2021,Good Model,5,,0,Grey Dazzle
RQZCZHIH172EG,Tamizhachi Yuva,Awesome nice product,Reviewed in India ・・・ｮ・・・ｳ on 28 July 2021,Best,5,,0,Grey Dazzle
R2EE3L6VIDJBMS,Amazon Customer,Reasonable item,Reviewed in India ・・・ｮ・・・ｳ on 16 August 2021,Reasonable one,5,,0,Grey Dazzle
R1NMT8BL207W2Z,Arvind Kumar,Like,Reviewed in India ・・・ｮ・・・ｳ on 4 September 2021,Good,5,,0,Grey Dazzle
R1VJ44ROWXQAD,Aliya Khan ,Easy to use,Reviewed in India ・・・ｮ・・・ｳ on 31 July 2021,Very easy to use ko,5,https://m.media-amazon.com/images/I/B1UaroQ8XkS.jpg,0,Grey Dazzle
