id,profileName,text,date,title,rating,images,helpful,Colour
R2WP58QB727CYW,Sachin Rathore,"Very Poor Quality. Body Plastic very weak. Burning Smell in the spinner within 1 and half months of use.I must say that this is a 'Maruti Car' of Washing Machines. As the Maruti has reduced the weight of its car to increase the mileage, the makers of this machine has reduced too much weight of this machine to keep it low priced.The plastic used is so thin that the outer body of the machine can be pressed easily with your hand. The machine slips from its position when spinner is working.  You place it at one place and you will find it 2 feet ahead.Just used it for one day with few clothes. washing is satisfactory.",Reviewed in India ・・・ｮ・・・ｳ on 3 October 2022,Very Poor Quality,1,,4,Grey Dazzle
REIN6TKX9DSLZ,Bhuwnesh Bhatt,Small family ke liye thik hai kuch bhi dholo!,Reviewed in India ・・・ｮ・・・ｳ on 18 June 2022,For small family,5,,0,Grey Dazzle
R2JKRZHAUOM1SA,Pankaj,Best collty,Reviewed in India ・・・ｮ・・・ｳ on 3 August 2022,Good ・・・・,5,,0,Grey Dazzle
R3LWN3SZ6GCQL3,Narendra tada,Good,Reviewed in India ・・・ｮ・・・ｳ on 16 August 2022,Compact product,5,,0,Grey Dazzle
RLX8M7DQ1MTA1,Rajveer Singh,Good,Reviewed in India ・・・ｮ・・・ｳ on 16 August 2022,Nice,5,,0,Grey Dazzle
R2MTVVAOI74OVT,Akshu K.,Good product,Reviewed in India ・・・ｮ・・・ｳ on 2 August 2022,Good product,5,,1,Grey Dazzle
R3S7R8UMJ0NBS7,deepak prajapati,Good,Reviewed in India ・・・ｮ・・・ｳ on 5 December 2021,Good,4,,0,Grey Dazzle
R3CGJ891Q8SMOX,Rohit K.,"Easy to use, dry the cloths in less time",Reviewed in India ・・・ｮ・・・ｳ on 20 June 2022,Good product,5,,0,Grey Dazzle
R3FPE6USQJ8U37,divyangparihar,Good,Reviewed in India ・・・ｮ・・・ｳ on 7 August 2022,Good,5,,0,Grey Dazzle
R3N6OWOJG9XQ0K,Deepak Aswal,First of all i am writing this review after three months of usage of the washing machine.The machine is lightweighted and works very well for washing as well as for drying the clothes. This is the value for money and very simple to use. You can easily transfer the machine from one room to another.I bought this machine afyer reviewing the number of machines in the market.Go for it. You will not be dissappointed.,Reviewed in India ・・・ｮ・・・ｳ on 7 March 2020,Very nice machine,5,,3,Grey Dazzle
R132250II49Y66,Vignesh Muthaiah,"Nice product , easy to use , so far good, high recommend for small family, use the twice in a week is good",Reviewed in India ・・・ｮ・・・ｳ on 26 March 2022,Good,5,,0,Grey Dazzle
R1SP13CRURORAA,SARAFARAZKHAN,Product is awesome but only one problem is there they should give switch to convert water flow in washing and drier department.,Reviewed in India ・・・ｮ・・・ｳ on 28 April 2021,Good product with one little but Very important lack,4,,0,Grey Dazzle
R381J8IZ35K2U4,Ash,So it has been over 2 months since i have brought this machine and have been using it.Overall the look of machine is very cool.Settings and functions are basic but as promised. The only con in this machine is the material used outside its very light weight but the quality of plastic is not good. Overall a good buy in this budget,Reviewed in India ・・・ｮ・・・ｳ on 2 October 2020,In the budget under 10k its a good product,3,,1,Grey Dazzle
R363X63KMECBZZ,Vimal Dhasmana,Good product. I have bought it based on 1st washing machine performance. I am using wirlpool washing machine 2nd time. 1st time i have used this product for about 18 years.Hope this time it works too.,Reviewed in India ・・・ｮ・・・ｳ on 25 July 2020,Very good,4,,0,Grey Dazzle
R2ZUXWQ882EC0L,Subodh,It's a very nice and powerful washing machine for a family of max 4 members. Only reason for giving 4 stars is that dryer is little bit smaller in size as compare to washer.,Reviewed in India ・・・ｮ・・・ｳ on 20 September 2020,Good product for a small family.,4,,0,Grey Dazzle
R14GZJDKBVVBLC,Paramasivam,One of the best semi automatic washing machineGood quality in 10000 price range,Reviewed in India ・・・ｮ・・・ｳ on 3 May 2022,Best washing machine,5,,0,Grey Dazzle
RZDA9Y316AI2E,Vinit vartak,"Good product,easy to use,light weight but solid. Only cons are due to its light weight sometimes it moves a little bit on tiles while washing.I recommend to keep rubber Matt underneath so that it doesn't move",Reviewed in India ・・・ｮ・・・ｳ on 14 August 2020,Worth buying,4,"https://images-na.ssl-images-amazon.com/images/I/71K7FbShnFL.jpg
https://images-na.ssl-images-amazon.com/images/I/71naC2hdHZL.jpg",0,Grey Dazzle
R3DT18L72ELGKF,naren,I like,Reviewed in India ・・・ｮ・・・ｳ on 19 July 2022,Best for home,5,,0,Grey Dazzle
R2DVDH76C6TJWV,TONMOY MAITY,My wife cool now,Reviewed in India ・・・ｮ・・・ｳ on 9 July 2022,Excellent,5,,0,Grey Dazzle
R1SS4I71B0SL7T,Chsk,Machine is working wellWont be satisfied for white clothes.If u spend 1000 or 1500 u will get better machine in samsung only with inbuilt scrubber and powerful motor.Better to buy 7.5kg,Reviewed in India ・・・ｮ・・・ｳ on 30 December 2021,Dont go after reviews,5,,0,Grey Dazzle
R27KWBW3QW84Q0,Abijith,"5 star rated,Easy to use,compact semi auto washing machine. Good colour and user friendly operating panel. Good service and delivery. Drawback observed was we have to switch the water hose between wash and drain station,instead of a button.",Reviewed in India ・・・ｮ・・・ｳ on 21 July 2020,Good performing semi auto machine in budget,4,,0,Grey Dazzle
R17MGUWYHF9JF4,Prince,Good,Reviewed in India ・・・ｮ・・・ｳ on 26 July 2022,Good,5,,0,Grey Dazzle
RQ2P9TVFUC52K,Sibichandran,Very good product,Reviewed in India ・・・ｮ・・・ｳ on 9 November 2021,Very good,4,,0,Grey Dazzle
RZN0MPM7WDM62,dawson,It's is very light and easy to use. Easily movable from one place to another coz of wheels. Got it on same as mention on delivery. Two people came as well from company for demo. Overall value for money . This review I am putting after 1 month use. ・・､・・､,Reviewed in India ・・・ｮ・・・ｳ on 12 May 2021,Value for money ・・・ｰ,5,"https://images-na.ssl-images-amazon.com/images/I/61HSLC8wZwL.jpg
https://images-na.ssl-images-amazon.com/images/I/61HZpUfLu0L.jpg
https://images-na.ssl-images-amazon.com/images/I/61nZ9xOdgVL.jpg",0,Grey Dazzle
RWQRA4RG51ENN,Samir Kumar Sukla,i have been using this for almost a month and it seems to be working fine. I haven't faced any issue with this washing machine.,Reviewed in India ・・・ｮ・・・ｳ on 10 February 2021,Best Product So far,4,,0,Grey Dazzle
R3O63R46X8S45Q,gautam kumar,Very nice and easy to use this product,Reviewed in India ・・・ｮ・・・ｳ on 23 February 2022,Easy to use and quality products,3,,0,Grey Dazzle
R2VSXOJVSYW4CZ,Rehana,"Overall good washing machine. but plastic boddy is little soft and sometimes feel it will be damaged easily. works good, spiner is also working good and fast.go for it. good choice if you buy it.",Reviewed in India ・・・ｮ・・・ｳ on 24 July 2020,Nice Product in this price.,4,,0,Grey Dazzle
R3EZSCDE39VOX,Shubham Kumar,Very good product,Reviewed in India ・・・ｮ・・・ｳ on 26 June 2022,Brilliant,5,,0,Grey Dazzle
R2G1YUKYU01B0B,Harekrishna,I had given 1* earlier but now giving 4* only for support got from whirlpool.,Reviewed in India ・・・ｮ・・・ｳ on 28 June 2021,Moderate,4,,0,Grey Dazzle
R1CEHB1GAC0GYS,Prameela a paragon ,This washing machine of 7kg is very good product. Since it washes upto load of 7kg it has a wide washing drum and it is best suitable for a family of more members. It is working superb without much noise.I like the product.,Reviewed in India ・・・ｮ・・・ｳ on 17 July 2021,7kg washing machine best for big washing.,5,,0,Grey Dazzle
R3AJLNB2QR4STR,Dibyendu Ghosh,"Very good product & excellent service. Powerful motor and easy installation . company person completed the installation . zero hassels. very sturdy product and durable. best washing ,machine",Reviewed in India ・・・ｮ・・・ｳ on 2 February 2022,Very good product & excellent service. Powerful motor,5,,0,Grey Dazzle
R2452U80NBOMP1,Priyatosh Das,I got a faulty product at first then I contact whirlpool service centre then a guy repair it.i don't know how it will work but I think it may be not bad and create any problem in future.,Reviewed in India ・・・ｮ・・・ｳ on 22 May 2020,Nice,4,https://images-na.ssl-images-amazon.com/images/I/71TKD0bE4FL.jpg,0,Grey Dazzle
R2Q4I8F3UV82Y3,Puneet Singh,Till now it working fine but in spin it take a lot of noise and movement at the time of start and end...else overall it's fine and working well,Reviewed in India ・・・ｮ・・・ｳ on 2 November 2020,Overall all is good but can be best,4,,0,Grey Dazzle
R2NJFLNE1YN3JW,Ranjan Satapathy,Good one,Reviewed in India ・・・ｮ・・・ｳ on 29 June 2022,Good one,5,,0,Grey Dazzle
R1DQ5SPGRDB2HH,Ghulam Mustafa,This product too bad do not buy,Reviewed in India ・・・ｮ・・・ｳ on 11 March 2023,Do not buy this product,1,,1,Grey Dazzle
R1G1IO5LB5S2E5,Shital bhandari,ﾂafeter uising 14-15day in running time unwanted sound creat,Reviewed in India ・・・ｮ・・・ｳ on 16 July 2022,afeter uising 14-15day in running time unwanted sound creat,5,,1,Grey Dazzle
R3C5PR0NJL83R1,Lokeshkumar,Good,Reviewed in India ・・・ｮ・・・ｳ on 10 July 2022,Good,5,,0,Grey Dazzle
R2CSVWOSXL81MN,Upendra,"Everything i like in it...... money wise it's cheap,very easy to use and yes very powerful.I am so confident that even a person who never used a semi automatic washing machine,can use it without any hustle.",Reviewed in India ・・・ｮ・・・ｳ on 22 September 2021,Must buy,5,,0,Grey Dazzle
R1IGTJF9XSIKO3,Sukrita dutt,Good,Reviewed in India ・・・ｮ・・・ｳ on 3 July 2022,Good,5,,0,Grey Dazzle
R1UJ5W1JVMBUGX,ISMAIL QAZI,"Each and everything is perfect as described. Machine performance is perfect, quality is perfect, overall a best product for the family of 3-4 members.No damages, on time delivery",Reviewed in India ・・・ｮ・・・ｳ on 15 September 2020,Perfect as described,4,,0,Grey Dazzle
RY1GWZLRZESFW,SmartBuyer,"Easy to use for my parents. They like it. Due to space constraints they store it to bedroom and when they need, they bring it near bathroom. Easy movement.Clothes are cleaning ok.",Reviewed in India ・・・ｮ・・・ｳ on 29 July 2020,Easy to use for my parents,4,,0,Grey Dazzle
R2B17ODEVD2BNF,mohit kumar,"A Super machine...after a long time, I chooses to buy for my home. Its gave me full confident to believe whirpool and online buying. Bought for Rs 8100/-, a good deal.Only pros- light wieght, portable as it has wheels, quick drying time, and satisfactory washing through 3 mode as heavy, normal and delicate. Recommended to go ahead with this product..",Reviewed in India ・・・ｮ・・・ｳ on 17 August 2020,Superb..must buy machine,5,,0,Grey Dazzle
RKQGTHUQSQRY4,Musharaf,Easy to use and keep also,Reviewed in India ・・・ｮ・・・ｳ on 12 September 2021,Nice product,4,,0,Grey Dazzle
R1YB23QBJGERZ,Elavarasan,Easy to use and cost worthy!,Reviewed in India ・・・ｮ・・・ｳ on 8 September 2021,Easy to use and cost worthy!,4,,0,Grey Dazzle
R1NW0RO2TREKJJ,MUKESH SINGH,Very Good Product. Easy to use,Reviewed in India ・・・ｮ・・・ｳ on 22 May 2022,Very good product,5,,0,Grey Dazzle
R2KQI2MTTAC4P1,Chhavi Mohan,It's very easy to Use ..,Reviewed in India ・・・ｮ・・・ｳ on 21 May 2022,Go for it guys.,5,,0,Grey Dazzle
R16RPACMBVU14B,Himanshu savner,It's really good and easy to use. I am satisfied with tha product..,Reviewed in India ・・・ｮ・・・ｳ on 7 April 2022,Excellent,5,,0,Grey Dazzle
R3HI627ZNIJX03,Smruti Ranjan Behera,Very easy to use & very light weight. Received as showing in pictures. No defects. Working as per my satisfaction from the date of delivery. I am washing daily my child's clothes. White vests are being cleaned better in this than front load washing machine. Amazon delivery person carried in to the room in the house without any extra cost.,Reviewed in India ・・・ｮ・・・ｳ on 2 September 2020,Very good machine at this price.,5,,0,Grey Dazzle
RTLKVPX3F464V,satya prakash,Too much movement in dryer.,Reviewed in India ・・・ｮ・・・ｳ on 23 May 2022,Good design,5,,0,Grey Dazzle
R1QZ7EN3TSW8MM,Ponds,I using this washing machine on part 3 weeks... Looking so elegant... Nice product washing clothes very neatly... Noise only little bit more.. but it's not a major problem.,Reviewed in India ・・・ｮ・・・ｳ on 27 November 2021,Superb product,5,,0,Grey Dazzle
R10E7AAQAMMLYF,Akash Purohit,This product is awesome,Reviewed in India ・・・ｮ・・・ｳ on 27 May 2022,Awesome,5,,0,Grey Dazzle
R2GTUHCZV5QG5Q,SUNEL ZONE,ﾂI will suggest to my friend and all buyer on Amazon not to buy this worst product whirpool because they sell all defective manufacturing product and nor give any solution under warranty those people want to waste off your mony they can go for this under nine months this product and major problem heating issue and manufacturing defect in body i amm suffering for buying this product and seller also selling bad product they ban on Amazon and whirpool also baned for this total worst product all money get wasted,Reviewed in India ・・・ｮ・・・ｳ on 4 August 2022,Worst product off my life whirpool,1,,2,Grey Dazzle
R2J88F1VLQ3WLR,Anand Singh shekhawat,Super p,Reviewed in India ・・・ｮ・・・ｳ on 12 June 2022,V useful best product,5,,0,Grey Dazzle
RSBUXEYRYW59G,Saswat,Pls share service provider no.my dryer will not work,Reviewed in India ・・・ｮ・・・ｳ on 7 July 2021,Pls suggest me the service provider no....my dryer will not work,4,,0,Grey Dazzle
RMM1CT6TDRI57,Md Mahfuz Alam,Excellent product,Reviewed in India ・・・ｮ・・・ｳ on 9 June 2022,Excellent,5,,0,Grey Dazzle
RZES1C9J80K9D,Ram,I like this product,Reviewed in India ・・・ｮ・・・ｳ on 24 May 2022,Good,5,,0,Grey Dazzle
R13O9BZFC2LOP7,mohammad sadiqua,Super quality.. Awesome performance,Reviewed in India ・・・ｮ・・・ｳ on 23 May 2022,Super quality.. Awesome performance,5,,0,Grey Dazzle
R3DZWEGKQ5K4OZ,luri borah,The inlet pipe should be long...,Reviewed in India ・・・ｮ・・・ｳ on 31 August 2021,Very easy to use,4,,0,Grey Dazzle
RPXU8H0TUXS3Q,Prince,Very good productThank you whirlpoolThank you Amazon,Reviewed in India ・・・ｮ・・・ｳ on 1 July 2021,Yes,4,,0,Grey Dazzle
R3QRLKS8227J1P,manoj kumar,Good Product.,Reviewed in India ・・・ｮ・・・ｳ on 20 September 2021,Good,4,,0,Grey Dazzle
R2WNW3Q7633CM1,Placeholder,"I recommend to everyone to purchase this model, very useful for 3-4 member",Reviewed in India ・・・ｮ・・・ｳ on 20 March 2022,Good Product made by whirlpool,5,,0,Grey Dazzle
R1R9BMUMML4F8O,Renjith,A littile bit extra sound on drier. Except everything fine. After using it for a month,Reviewed in India ・・・ｮ・・・ｳ on 3 March 2021,Sound on drier,4,,0,Grey Dazzle
R3IC5RVYNJKJSS,Naveen Rautela,A good product by Whirlpool in this price range satisfied with this but plastic material is not up to the mark.,Reviewed in India ・・・ｮ・・・ｳ on 22 November 2020,Good one,4,,0,Grey Dazzle
R2N08LLWHQ1PN2,Minakshi pathak,Good,Reviewed in India ・・・ｮ・・・ｳ on 5 June 2022,Good,5,,0,Grey Dazzle
R38PX0UQY1MSQN,Hemanta Kumar sahoo,Nice,Reviewed in India ・・・ｮ・・・ｳ on 9 June 2022,Nice,5,,0,Grey Dazzle
R2RF6G9B76QN06,rajkumar,Product was finished completely with light plastic material and looks like so fragile... Looks cool and vibrant and would have made with better quality materials...,Reviewed in India ・・・ｮ・・・ｳ on 5 September 2020,Looks vibrant but body build with light plastic,4,,0,Grey Dazzle
R3FEOJO4JFYOY1,madhu,Nice product easy to use,Reviewed in India ・・・ｮ・・・ｳ on 1 August 2021,"first one served 23 years, dryer is not working  so we bought 2nd one from whirlpool",4,,0,Grey Dazzle
R1FS3681YI6DRH,javed hassan,I am happy ・・・・,Reviewed in India ・・・ｮ・・・ｳ on 25 August 2021,Nice product ・・・・,4,,0,Grey Dazzle
R3DIISTV4HVT5F,nitin srivastav,Great Buy with very affordable prices .very easy to use,Reviewed in India ・・・ｮ・・・ｳ on 6 April 2022,Great Buy,5,,0,Grey Dazzle
R24CL3JHWVLYXT,sudheesh stephen,Excellent product. Value for money. Only disadvantage is that we have to change the water inlet hose frequently for wash and spin.,Reviewed in India ・・・ｮ・・・ｳ on 14 October 2020,Excellent,4,"https://images-na.ssl-images-amazon.com/images/I/61emKfE6jDL.jpg
https://images-na.ssl-images-amazon.com/images/I/61jO6hnfohL.jpg",0,Grey Dazzle
R1L6LQR65HJTL8,Amazon Customer,"Unfortunately I received a Defective Product in Prime Day Offer sale..The timer of Dryer is not working correctly... And the Dryer just keeps on running continuously... When I requested for replacement, they simply processed return and refund... Because maybe Defective pieces only can be given for offer.. LoL :-)I was initially happy when I bought it on offer , but offer brought me sorrow now because they say the Replacement is not possible... Only Return and Refund.. Such is the Amazon service..",Reviewed in India ・・・ｮ・・・ｳ on 27 August 2022,I received a Defective Product in Prime Day Offer sale only return and refund done,1,https://m.media-amazon.com/images/I/61gFYTR33HL.jpg,3,Grey Dazzle
R3QR75G343K2XN,Avinash Manohar Shinde,I like the machine it's good however dilvery was not good the box was toren however machine is good.,Reviewed in India ・・・ｮ・・・ｳ on 12 December 2020,Should go for whirlpool washing machine.,4,,0,Grey Dazzle
R2PFPTEDMDXDDO,Rahul,"Easy to use, time saver and lesser space  with good looks",Reviewed in India ・・・ｮ・・・ｳ on 15 March 2022,Really convenient,5,,0,Grey Dazzle
R12J8SAYGA0XCZ,Uk,This machine is not meet my requirement I tried requesting to get replacement but I didn・・t get. Still I・・m requesting for get replacement for next version,Reviewed in India ・・・ｮ・・・ｳ on 6 January 2023,Not meet my requirement,1,,1,Grey Dazzle
RTUW85ES1S29O,Sarvesh Chandu,"Except the back cover everything seems fine as a simple and easy to use semi automatic washing machine, back cover looks very low quality material including drain pipe hookPerformance is goodNoise is not highVibration is also less while using dryer7kg is ideal for family of upto 4",Reviewed in India ・・・ｮ・・・ｳ on 3 November 2020,Good in performance and build,5,,0,Grey Dazzle
R3N1H1W7VBGHKJ,Neel,Machine's body is too thin.... should be more thick,Reviewed in India ・・・ｮ・・・ｳ on 13 May 2021,Value for money,4,,0,Grey Dazzle
R2LC99FFH8205J,MK,ﾂMultiple of scratches on new machine body.on the new machine it shouldn't be there.,Reviewed in India ・・・ｮ・・・ｳ on 14 June 2021,Machine performance and life.,4,https://images-na.ssl-images-amazon.com/images/I/B1EjUG4NbtS.jpg,0,Grey Dazzle
R1PAXOKKPA0ROJ,Sravani,Performance is good...wheels are the best part,Reviewed in India ・・・ｮ・・・ｳ on 9 June 2021,Good looking,4,,0,Grey Dazzle
R2NB6GPO8QAZL2,ANKUR,Good,Reviewed in India ・・・ｮ・・・ｳ on 10 September 2021,Good,4,,0,Grey Dazzle
R32PQOTYL2DCVI,Perwez Alam,easy to opreat,Reviewed in India ・・・ｮ・・・ｳ on 18 August 2021,good prodouct,4,,0,Grey Dazzle
R3UGDJHKPZI7LQ,GOVIND,Good product,Reviewed in India ・・・ｮ・・・ｳ on 16 May 2022,Best perfomance,5,,0,Grey Dazzle
R3T2BZ1QQGB0ZC,・､ｭ・､・・､ｾ・､ｰ・､ｾ ASSOCIATES,good,Reviewed in India ・・・ｮ・・・ｳ on 28 May 2022,Very nice product,5,,0,Grey Dazzle
R1LV244MCZCE19,Parth Joshi,Spin drier is too good. Overall performance of the model is above par.,Reviewed in India ・・・ｮ・・・ｳ on 14 March 2021,Perfect for bachelors,4,,0,Grey Dazzle
R3ASAWU4QMP0YC,Rajesh Koul,"Overall it is a good machine. The only drawback is, its more manual  than auto. In this machine you have to change the water pipe from washing slot to spin slot. That is the only nonsense in this machin. Other wise the machine is really good, working effectively. You can buy this machine without any doubt.",Reviewed in India ・・・ｮ・・・ｳ on 1 August 2020,Good Product,5,,0,Grey Dazzle
RJO2LG2OWZJ9J,Divya Yadav,Good quality and looks ...also the delivery guys were very helpful・・・ｸ,Reviewed in India ・・・ｮ・・・ｳ on 19 March 2022,Amazing product and delivery service ・・､・ｸ・,5,"https://m.media-amazon.com/images/I/612cCcoasmL.jpg
https://m.media-amazon.com/images/I/718NFGK7UsL.jpg",0,Grey Dazzle
R1P3U3U7A2TLCI,Amazon Customer,Easy to use,Reviewed in India ・・・ｮ・・・ｳ on 29 August 2021,Solves purpose,4,,0,Grey Dazzle
R3A6F3T92O744Y,madhu,Like it but spinning button was not there,Reviewed in India ・・・ｮ・・・ｳ on 11 May 2021,Good,4,,0,Grey Dazzle
R3O80XUVDMKSBB,sujay aswin,"Heavy vibration while running, In Samsung the vibration is less...",Reviewed in India ・・・ｮ・・・ｳ on 12 December 2021,"Heavy wobbling while running, Can buy Samsung than this",3,,0,Grey Dazzle
R2WE2RMFZ5RZL7,Deepak Gaur,Changing the water inlet from wash to spin tub us a big hassle,Reviewed in India ・・・ｮ・・・ｳ on 15 November 2021,Water Inlet Design Needs Improvement,3,,0,Grey Dazzle
R3TCRR5KUOZ74D,Prateek Shukla,I have used multiple brand of washing machine but my experience is more better with this one. Thanks you Amazon,Reviewed in India ・・・ｮ・・・ｳ on 7 November 2020,Superior Quality Ultimate Experience,4,"https://images-na.ssl-images-amazon.com/images/I/61S-EcnA9CL.jpg
https://images-na.ssl-images-amazon.com/images/I/61kqp9vJkVL.jpg",0,Grey Dazzle
R10ZVYG282WN51,Sameer najmuddin sayyed,Back side cover is just local material,Reviewed in India ・・・ｮ・・・ｳ on 19 May 2021,Quit good,4,,0,Grey Dazzle
RKSHGFGN1BYB4,D. sen,"To make the product cheaper company has removed the water switching knob  (spin to wash and vice-versa),you have to change the pipe,The  wash complete alarm is annoying,Then machine vibrates too much due to the wheels while washing,",Reviewed in India ・・・ｮ・・・ｳ on 1 December 2022,No water switching knob,1,,1,Grey Dazzle
RVZYHBZKM50U8,satish,Easy to use n nice product,Reviewed in India ・・・ｮ・・・ｳ on 10 June 2021,V gud,4,,0,Grey Dazzle
R31AT6ZMP9OMJM,Mahesh Chander,It's a very good product one problem is I did not get the warranty card and the water pipe is very small,Reviewed in India ・・・ｮ・・・ｳ on 25 September 2020,Nice product,4,,0,Grey Dazzle
RTZWNH04W4HOJ,Sunil Bhati,It tooks 45 minutes for 1 cycle really hate it.i m ready to sell it at 6000.If u have free time then only buy it as soaking time is grater then spinningif any one wants live demo u can test me and I can show it's working on video call.i m missing my exchanged machine it was 10 yr old but far better then it,Reviewed in India ・・・ｮ・・・ｳ on 3 October 2022,Don't buy it,1,,3,Grey Dazzle
R1R59IR2834M0S,Arvind Kumar,Good,Reviewed in India ・・・ｮ・・・ｳ on 29 August 2021,Very good product,4,,0,Grey Dazzle
R174708UOVTRQG,Ritesh Singh,Bought whirlpool as preferred from other brands because whirlpool waching machine are good. But unfortunately my machine developed problem in dryer compartment. During spinning noise used to come. It was repaired in warranty but issue appeared again. Now machine is out of warranty ・・・・.,Reviewed in India ・・・ｮ・・・ｳ on 30 November 2022,Dryer issue with my machine,1,,0,Grey Dazzle
R2NKRXPC8F5IN7,Manoj Waghela,One of the best whirlpool semi automatic 7 kg washing machine,Reviewed in India ・・・ｮ・・・ｳ on 12 March 2022,One of the best semi automatic 7kg washing machine,5,"https://m.media-amazon.com/images/I/61QKe+mIv6L.jpg
https://m.media-amazon.com/images/I/71W7ELCas5L.jpg
https://m.media-amazon.com/images/I/71n7n3tWNtL.jpg",0,Grey Dazzle
R1FIN3US51IIU4,Nripendra kumar,Good product,Reviewed in India ・・・ｮ・・・ｳ on 30 July 2021,Lovely,4,,0,Grey Dazzle
R3FQ74OKV5OFEA,Firoz,Good item. Works well but only the plastic body feels very low quality and not durable ....,Reviewed in India ・・・ｮ・・・ｳ on 21 November 2020,Good,4,,0,Grey Dazzle
R1LP7HFJPZ6DH0,Ashraf Ali,"Light weight machine, Easy to move anywhere good performance so far..",Reviewed in India ・・・ｮ・・・ｳ on 13 March 2021,Good One,4,,0,Grey Dazzle
R2T0KLPKDCU1KZ,NP,Would have been easier if didn't have to repeatedly change water pipe for washing and drying.,Reviewed in India ・・・ｮ・・・ｳ on 14 December 2020,Good machine,4,,0,Grey Dazzle
R1QFY9RNHRW5C5,Saima Fatima,very good product...fast delivery ...but drain pipe is very short... disappointed only with drain pipe... overall good product...,Reviewed in India ・・・ｮ・・・ｳ on 1 November 2020,short Drain pipe,4,https://images-na.ssl-images-amazon.com/images/I/91LQycfbE5L.jpg,0,Grey Dazzle
R2PNREYUCHPGWQ,Prithvi,All is good except it makes too much of noise.,Reviewed in India ・・・ｮ・・・ｳ on 20 March 2021,All is good except it makes too much of noise.,4,,0,Grey Dazzle
R1EIS40NOATN9K,Dileep Srivastava,Easy to use also very good product. U should buy if u have a family of 7 to 8 members also if ur budget is low as i get it in 9k. But overall its very good deal.,Reviewed in India ・・・ｮ・・・ｳ on 27 April 2021,Very Good Deal in 9k,5,,0,Grey Dazzle
R354KNKIC84S1Q,Amazon Customer,I am using the washing machine daily. It is easy to use and very light weight.,Reviewed in India ・・・ｮ・・・ｳ on 28 November 2020,Good Product,4,,0,Grey Dazzle
